{
  "version": "hermes-receipt/v1",
  "instruction": {"name": "instruction", "sha256": "e3b0c44298fc1c149afbf4c8996fb92427ae41e4649b934ca495991b7852b855", "size": 0},
  "approved_inputs": [],
  "tools": [],
  "final_output": {"name": "output", "sha256": "ba7816bf8f01cfea414140de5dae2223b00361a396177a9cb410ff61f20015ad", "size": 3},
  "receipt_digest": "65c3c653b6d636a7af184a931754359ada7210fc29041bd7e7147b6ec07e1fbf"
}
